{
	"$schema": "https://schemas.cexpay.io/api/v3/account/account.create-request.json",
	"clientAccountId": "unique merchant's identifier",
	"clientAccountTag": "Account for merchant's user XXX",
	"currency": "BTC",
	"triggers": [
		{
			"kind": "ORDER_GENERATOR",
			"to": {
				"currency": "USD"
			}
		}
	]
}
